Common Name,Primary Genre,Combined Genres,TimeBirth,TimeDeath,Birth-Death Text,Abstract,City Text,County text,Personal Website,PSU Catalog Link - HTML,Expanded Biography,PIC_URL,Latitude,Longitude,Photo Credit,Alt Text,City | County | Bio Link,PSU Link | Personal Website
Thomas Buchanan Read,Poetry,Poetry,03/12/1842,5/11/1872,3/12/1822 - 5/11/1872,"<p>Born in Corner Ketch, Pennsylvania, in 1822, Thomas Buchanan Read both painted and wrote about a fervently patriotic and idealistic subject matter. Befriending famed poet Henry Wadsworth Longfellow and spending a great deal of his adult life in Italy, Read was a major figure in mid-nineteenth century literary and artistic culture. He produced some of the most recognizable Civil War images and verse in multiple renditions of his <em>Sheridan's Ride</em> (1871) and lyrically captured the aesthetic quality of Pennsylvania's geography in ""The New Pastoral"" (1855). He died in 1872 in New York City.</p>","Corner Ketch, PA",Chester County,,"<a href=""https://catalog.libraries.psu.edu/?f[all_authors_facet][]=Read%2C+Thomas+Buchanan%2C+1822-1872"" target=""_blank"">PSU Catalog Link</a>","<a href=""https://pabook.libraries.psu.edu/literary-cultural-heritage-map-pa/bios/Read__Thomas_Buchanan"" target=""_blank"">Expanded Biography</a>",https://pabook.libraries.psu.edu/sites/default/files/biosimages/Read__Thomas_Buchanan.jpg,40.026078,-75.750019,Photo Credit: Photograph of Thomas Buchanan Read. ca. 1840. Photograph. Licensed under Public Domain. Cropped to 4x3. Source: Wikimedia Commons. Source: https://upload.wikimedia.org/wikipedia/commons/f/f9/Thomas_Buchanan_Read_age_28.jpg.,,"Corner Ketch, PA | Chester County | <a href=""https://pabook.libraries.psu.edu/literary-cultural-heritage-map-pa/bios/Read__Thomas_Buchanan"" target=""_blank"">Expanded Biography</a>","<a href=""https://catalog.libraries.psu.edu/?f[all_authors_facet][]=Read%2C+Thomas+Buchanan%2C+1822-1872"" target=""_blank"">PSU Catalog Link</a>"
John Repp,Poetry,Poetry,02/18/1973,1/1/2050,Born: 2/18/1953,"<p>John Repp, born February 18, 1953, has earned two Master of Fine Arts degrees, the first from Central Michigan University in 1980, and a second from the University of Pittsburgh in 1985. Since that time he has published poems, short stories, and essays in a wide variety of publications and has written several books and chapbooks including <em>Thirst Like This</em> (1990), <em>The Fertile Crescent </em>(2004)<em>,</em> and<em> Gratitude </em>(2005)<em>. </em>He has also earned several awards, including a National Endowment for the Arts Creative Writing Fellowship in 1987. At the time of this writing, Repp teaches at Edinboro University, where he lives with his wife and son.</p>","Erie, PA",Erie County,http://www.johnreppwriter.com,"<a href=""https://catalog.libraries.psu.edu/?f[all_authors_facet][]=Repp%2C+John"" target=""_blank"">PSU Catalog Link</a>","<a href=""https://pabook.libraries.psu.edu/literary-cultural-heritage-map-pa/bios/Repp__John"" target=""_blank"">Expanded Biography</a>",https://pabook.libraries.psu.edu/sites/default/files/biosimages/Repp__John.jpg,42.127665,-80.088284,"Photo Credit: John Repp, MA, MFA. Photograph. Licensed under Fair Use. Cropped to 4x3, Filled background. Source: Online Resource. Source: http://www.edinboro.edu/academics/schools-and-departments/cahss/departments/english/faculty-and-staff.html.",,"Erie, PA | Erie County | <a href=""https://pabook.libraries.psu.edu/literary-cultural-heritage-map-pa/bios/Repp__John"" target=""_blank"">Expanded Biography</a>","<a href=""https://catalog.libraries.psu.edu/?f[all_authors_facet][]=Repp%2C+John"" target=""_blank"">PSU Catalog Link</a> | <a href=""http://www.johnreppwriter.com"" target=""_blank"">Personal Website</a>"
Jewell Parker Rhodes,Young Adult (YA),Young Adult (YA) | Fiction,01/01/1974,1/1/2050,Born: 1954,"<p>Young adult fiction author Jewell Parker Rhodes was born in Pittsburgh, Pennsylvania, and earned degrees in Drama Criticism, English, and Creative Writing from Carnegie Mellon University. Her work is informed by her personal struggles with loneliness and her absent mother, as well as African American cultural traditions and historical figures. Read more <a href=""https://sites.psu.edu/pablackwriters/the-writers/jewell-parker-rhodes/"" target=""_blank"">here</a></p><p>""Jewell Parker Rhodes."" <em>Black Writers of PA.</em> 2020. 31 August 2020.</p>","Pittsburgh, PA",Allegheny County,https://jewellparkerrhodes.com/,"<a href=""https://catalog.libraries.psu.edu/?f[all_authors_facet][]=Rhodes%2C+Jewell+Parker"" target=""_blank"">PSU Catalog Link</a>",,https://pabook.libraries.psu.edu/sites/default/files/biosimages/Rhodes__Jewell.jpg,40.456598,-80.025777,"Photo Credit: Photograph of Jewell Parker Rhodes. Photograph. Licensed under Fair Use. Cropped to 4x3, Filled background. Source: Online Resource. Source: https://jewellparkerrhodes.com/adult/wp-content/uploads/2011/01/Jewell-Parker-Rhodes.jpg.",,"Pittsburgh, PA | Allegheny County","<a href=""https://catalog.libraries.psu.edu/?f[all_authors_facet][]=Rhodes%2C+Jewell+Parker"" target=""_blank"">PSU Catalog Link</a> | <a href=""https://jewellparkerrhodes.com/"" target=""_blank"">Personal Website</a>"
Barbara Chase-Riboud,Fiction,Fiction,06/26/1959,1/1/2050,Born: 06/26/1939,"<p>Artist and fiction writer Barbara Chase-Riboud was born in Philadelphia, Pennsylvania, and graduated from Temple University with a bachelor's degree in fine arts. A jack-of-all-trades, she took piano and ballet as a child, found a voice in sculpture, and later adopted poetry and fiction. Read more <a href=""https://sites.psu.edu/pablackwriters/the-writers/barbara-chase-riboud/"" target=""_blank"">here</a>.</p><p>""Barbara Chase-Riboud."" <em>Black Writers of PA.</em> 2020. 31 August 2020.</p>","Philadelphia, PA",Philadelphia County,https://www.hauserwirth.com/artists/41313-barbara-chase-riboud/,"<a href=""https://catalog.libraries.psu.edu/?f[all_authors_facet][]=Chase-Riboud%2C+Barbara"" target=""_blank"">PSU Catalog Link</a>",,https://pabook.libraries.psu.edu/sites/default/files/biosimages/Chase-Riboud__Barbara.jpg,39.939424,-75.1554,"Photo Credit: Dawn breakergm. Barbara Chase-Riboud with her Malcolm X steles, Michael Rosenfeld Gallery. 17 Jan 2018. Photograph. Licensed under CC BY-SA 4.0. Cropped to 4x3. Source: Wikimedia Commons. Source: https://upload.wikimedia.org/wikipedia/commons/e/e1/Barbara_Chase-Riboud.jpg.",,"Philadelphia, PA | Philadelphia County","<a href=""https://catalog.libraries.psu.edu/?f[all_authors_facet][]=Chase-Riboud%2C+Barbara"" target=""_blank"">PSU Catalog Link</a> | <a href=""https://www.hauserwirth.com/artists/41313-barbara-chase-riboud/"" target=""_blank"">Personal Website</a>"
Conrad Richter,Fiction,Fiction,10/13/1910,10/30/1968,10/13/1890 - 10/30/1968,"<p>A longtime resident of Pennsylvania, Conrad Richter was born in 1890 in Pine Grove. Known for his frontier novels and detailed depiction of pioneer life, Richter wrote <em>The Sea of Grass</em> about New Mexico's farmers and ranchers in 1937. He also wrote the Pulitzer Prize wining novel <em>The Town</em> (1950). Richter then won the National Book Award for his self-inspired novel <em>The Waters of Kronos </em>(1960). Richter passed away a few miles from his birthplace in 1968 in Pottsville, Pennsylvania.</p>","Pine Grove, PA",Schuylkill County,,"<a href=""https://catalog.libraries.psu.edu/?f[all_authors_facet][]=Richter%2C+Conrad%2C+1890-1968"" target=""_blank"">PSU Catalog Link</a>","<a href=""https://pabook.libraries.psu.edu/literary-cultural-heritage-map-pa/bios/Richter__Conrad"" target=""_blank"">Expanded Biography</a>",https://pabook.libraries.psu.edu/sites/default/files/biosimages/Richter__Conrad.jpg,40.545738,-76.38428,"Photo Credit: Carl Mydans. Conrad Richter standing on Tulpehocken Street, Pine Grove, PA, 1962. ca. 1962. Photograph. Licensed under Fair Use. Cropped to 4x3. Source: Online Resource. Source: https://2.bp.blogspot.com/-OtEa7D8kJrk/VDvpjW5Vs_I/AAAAAAAAHKk/bNUFp4JNpR8/s1600/conradrichter.jpg.",,"Pine Grove, PA | Schuylkill County | <a href=""https://pabook.libraries.psu.edu/literary-cultural-heritage-map-pa/bios/Richter__Conrad"" target=""_blank"">Expanded Biography</a>","<a href=""https://catalog.libraries.psu.edu/?f[all_authors_facet][]=Richter%2C+Conrad%2C+1890-1968"" target=""_blank"">PSU Catalog Link</a>"
Mary Roberts Rinehart,Fiction,Fiction | Nonfiction,08/12/1896,9/22/1958,8/12/1876 - 9/22/1958,"<p>Born in Allegheny City in 1876, Mary Rinehart rose to become one of America's most prominent and successful mystery writers without formal education beyond nursing school. Although her best-known writing falls into the mystery genre, she wrote a great deal of nonfiction as she served as a reporter during World War I and published numerous accounts of her travels throughout the American West. Rinehart also wrote and produced several successful plays. In her later years, she started a publishing firm with her sons, which published many of her novels. Rinehart died in 1958, a highly-acclaimed popular writer.</p>","Pittsburgh, PA",Allegheny County,,"<a href=""https://catalog.libraries.psu.edu/?f[all_authors_facet][]=Rinehart%2C+Mary+Roberts%2C+1876-1958"" target=""_blank"">PSU Catalog Link</a>","<a href=""https://pabook.libraries.psu.edu/literary-cultural-heritage-map-pa/bios/Rinehart__Mary_Roberts"" target=""_blank"">Expanded Biography</a>",https://pabook.libraries.psu.edu/sites/default/files/biosimages/Rinehart__Mary_Roberts.jpg,40.453069,-80.016634,Photo Credit: Theodore Christopher Marceau. Photograph of Mary Roberts Rinehart. ca. 1914. Photograph. Licensed under Public Domain. Cropped to 4x3. Source: Wikimedia Commons. Source: https://upload.wikimedia.org/wikipedia/commons/f/fe/Mary_Roberts_Rinehart.jpg.,,"Pittsburgh, PA | Allegheny County | <a href=""https://pabook.libraries.psu.edu/literary-cultural-heritage-map-pa/bios/Rinehart__Mary_Roberts"" target=""_blank"">Expanded Biography</a>","<a href=""https://catalog.libraries.psu.edu/?f[all_authors_facet][]=Rinehart%2C+Mary+Roberts%2C+1876-1958"" target=""_blank"">PSU Catalog Link</a>"
Gene Roberts,Journalism,Journalism,06/15/1952,1/1/2050,Born: 6/15/1932,"<p>Former executive editor at <em>The Philadelphia Inquirer</em>, Gene Roberts achieved national acclaim for leading the paper to 17 Pulitzer Prizes in an 18-year span. He was born June 15, 1932, in Pikeville, North Carolina. Despite his humble beginnings as a journalist in rural North Carolina, Roberts covered tough issues in the 1960s, including the Civil Rights Movement. His hard work as a journalist paid off as he ended up editing for newspapers such as the <em>Detroit Free Press</em>, <em>The Philadelphia Inquirer</em>, and <em>The New York Times</em>. In 2007, Roberts and co-author Hank Klibanoff won a Pulitzer Prize for their book <em>The Race Beat: The Press, the Civil Rights Struggle, and the Awakening of a Nation </em>(2007)<em>.</em> Roberts is one of the most widely respected journalists of his era and many believe no one will ever match his drive and determination in running a newsroom.</p>","Philadelphia, PA",Philadelphia County,,"<a href=""https://catalog.libraries.psu.edu/?f[all_authors_facet][]=Roberts%2C+Gene"" target=""_blank"">PSU Catalog Link</a>","<a href=""https://pabook.libraries.psu.edu/literary-cultural-heritage-map-pa/bios/Roberts__Eugene"" target=""_blank"">Expanded Biography</a>",https://pabook.libraries.psu.edu/sites/default/files/biosimages/Roberts__Gene.jpg,39.951787,-75.153827,"Photo Credit: Danny Johnston/AP. Gene Roberts, Speaking at the Clinton Presidential Library. ca. 2007. Photograph. Licensed under Fair Use. Cropped to 4x3. Source: Online Resource. Source: http://www.niemanlab.org/images/gene-roberts-ap.jpg.",,"Philadelphia, PA | Philadelphia County | <a href=""https://pabook.libraries.psu.edu/literary-cultural-heritage-map-pa/bios/Roberts__Eugene"" target=""_blank"">Expanded Biography</a>","<a href=""https://catalog.libraries.psu.edu/?f[all_authors_facet][]=Roberts%2C+Gene"" target=""_blank"">PSU Catalog Link</a>"
Len Roberts,Poetry,Poetry,03/13/1967,5/25/2007,3/13/1947 - 5/25/2007,"<p>Leonard (Len) Roberts grew up in Cohoes, New York and began writing poetry at the age of 28. He published 10 books of poetry, including <em>Black Wings </em>(1989)<em>,</em> <em>The Trouble Making Finch </em>(1998)<em>,</em> and <em>The Silent Singer: New and Selected Poems </em>(2001), and several translations of the poetry of Sándor Csoóri, a famous Hungarian poet. For his work, Roberts received a multitude of awards, such as the Fulbright Scholar Award, the National Poetry Series Award, and the John Simon Guggenheim Memorial Award. He passed away in 2007 in Bethlehem, Pennsylvania, having taught English at Northampton Community College for more than 30 years.</p>","Bethlehem, PA",Northampton County,,"<a href=""https://catalog.libraries.psu.edu/?f[all_authors_facet][]=Roberts%2C+Len%2C+1947-2007"" target=""_blank"">PSU Catalog Link</a>","<a href=""https://pabook.libraries.psu.edu/literary-cultural-heritage-map-pa/bios/Roberts__Len"" target=""_blank"">Expanded Biography</a>",https://pabook.libraries.psu.edu/sites/default/files/biosimages/Roberts__Len.jpg,40.672517,-75.32351,Photo Credit: Photograph of Len Roberts. Photograph. Licensed under Fair Use. Cropped to 4x3. Source: Online Resource. Source: https://1.bp.blogspot.com/-1F5sLu3hVow/VbrlYEXek6I/AAAAAAAACiQ/WJqquex0ZIk/s1600/Poet%2BRoberts.png.,,"Bethlehem, PA | Northampton County | <a href=""https://pabook.libraries.psu.edu/literary-cultural-heritage-map-pa/bios/Roberts__Len"" target=""_blank"">Expanded Biography</a>","<a href=""https://catalog.libraries.psu.edu/?f[all_authors_facet][]=Roberts%2C+Len%2C+1947-2007"" target=""_blank"">PSU Catalog Link</a>"
Barbara Robinson,Children's,Children's,10/24/1947,7/9/2013,10/24/1927 - 7/9/2013,"<p>Barbara Robinson was born in Ohio on October 24, 1927. She began writing poetry at a young age and by adulthood had published over 40 short stories in national journals, including ""Best Christmas"" in <em>McCall's</em> (1971) the genesis of her most celebrated work, <em>The Best Christmas Pageant Ever</em> (1972). She was a Breadloaf Fellow and the recipient of numerous awards, including the Young Hoosier Book Award and Library Association (ALA) Notable Children's Book Award. On July 9, 2013, at age 85, she died of cancer at her home in Berwyn, PA, leaving behind two daughters and three grandchildren.</p>","Berwyn, PA",Chester County,,,"<a href=""https://pabook.libraries.psu.edu/literary-cultural-heritage-map-pa/bios/Robinson__Barbara_Webb"" target=""_blank"">Expanded Biography</a>",https://pabook.libraries.psu.edu/sites/default/files/biosimages/Robinson__Barbara_Webb.jpg,40.044065,-75.441437,"Photo Credit: Virginia Gleason. Photograph of Barbara Robinson. Photograph. Licensed under Fair Use. Cropped to 4x3, Filled background. Source: Harper Collins Publishers . Source: Online Resource. Source: https://i.harperapps.com/authors/12649/x300.jpg.",,"Berwyn, PA | Chester County | <a href=""https://pabook.libraries.psu.edu/literary-cultural-heritage-map-pa/bios/Robinson__Barbara_Webb"" target=""_blank"">Expanded Biography</a>",
Theodore Roethke,Poetry,Poetry,05/25/1928,8/1/1963,5/25/1908 - 8/1/1963,"<p>Leading American poet Theodore Roethke taught at both Lafayette College in Easton, Pennsylvania, and the Pennsylvania State University in State College, Pennsylvania, where he coached the Penn State Blue and White tennis team for five seasons. Read more <a href=""https://www.britannica.com/biography/Theodore-Roethke"" target=""_blank"">here</a>.</p><p>Editors, Encyclopaedia Britannica. Theodore Roethke: American Poet. <em>Encyclopaedia Britannica website.</em> 28 July 2018. 7 November 2018.</p>","University Park, PA",Centre County,,"<a href=""https://catalog.libraries.psu.edu/?f[all_authors_facet][]=Roethke%2C+Theodore%2C+1908-1963"" target=""_blank"">PSU Catalog Link</a>","<a href=""https://pabook.libraries.psu.edu/literary-cultural-heritage-map-pa/bios/Roethke__Theodore"" target=""_blank"">Expanded Biography</a>",https://pabook.libraries.psu.edu/sites/default/files/biosimages/Roethke__Theodore.jpg,40.805072,-77.859925,Photo Credit: Photograph of Theodore Roethke. Photograph. Licensed under Fair Use. Cropped to 4x3. Source: Online Resource. Source: https://images.gr-assets.com/authors/1238753648p8/7531.jpg.,,"University Park, PA | Centre County | <a href=""https://pabook.libraries.psu.edu/literary-cultural-heritage-map-pa/bios/Roethke__Theodore"" target=""_blank"">Expanded Biography</a>","<a href=""https://catalog.libraries.psu.edu/?f[all_authors_facet][]=Roethke%2C+Theodore%2C+1908-1963"" target=""_blank"">PSU Catalog Link</a>"
Fred Rogers,Children's,Children's,03/20/1948,2/27/2003,3/20/1928 - 2/27/2003,"<p>Children's book author and creator of his namesake TV show, Mister Rogers was born in Latrobe, Pennsylvania, attended the Pittsburgh Theological Seminary and the University of Pittsburgh's Graduate School of Child Development,and created children's programs for broadcast stations in Pittsburgh, Pennsylvania. Read more <a href=""https://www.misterrogers.org/about-fred-rogers/"" target=""_blank"">here</a>.</p><p>The Fred Rogers Company. About Fred Rogers. <em>Mister Rogers' Neighborhood website. </em>2018. 7 November 2018.</p>","Latrobe, PA",Westmoreland County,,"<a href=""https://catalog.libraries.psu.edu/?f[all_authors_facet][]=Rogers%2C+Fred"" target=""_blank"">PSU Catalog Link</a>","<a href=""https://pabook.libraries.psu.edu/literary-cultural-heritage-map-pa/bios/Rogers__Fred_McFeely"" target=""_blank"">Expanded Biography</a>",https://pabook.libraries.psu.edu/sites/default/files/biosimages/Rogers__Fred_McFeely.jpg,40.29027,-79.39953,"Photo Credit: Rogelio A. Galaviz C.. Fred Rogers rehearses the opening of his PBS show ""Mister Rogers' Neighborhood"" during a taping in this June 28, 1989 file photo, in Pittsburgh. ca. 1989. Photograph. Licensed under CC BY-NC 2.0. Cropped to 4x3. Source: Flickr. Source: https://bit.ly/4fSosyw.",,"Latrobe, PA | Westmoreland County | <a href=""https://pabook.libraries.psu.edu/literary-cultural-heritage-map-pa/bios/Rogers__Fred_McFeely"" target=""_blank"">Expanded Biography</a>","<a href=""https://catalog.libraries.psu.edu/?f[all_authors_facet][]=Rogers%2C+Fred"" target=""_blank"">PSU Catalog Link</a>"
Sarah Tyson Rorer,Nonfiction,Nonfiction,10/18/1869,12/27/1937,10/18/1849 - 12/27/1937,"<p>Sarah Tyson Rorer was born on October 18, 1849, in Bucks County, Pennsylvania. Over the course of her life, she worked as a cookbook author, editor, magazine columnist, and orator. Her work focused on the influence food has on the body, especially on the sick or malnourished. She is considered to be America's first dietician. She opened the Philadelphia Cooking School and influenced the field of hospital dietetics through her work there. Rorer authored numerous cookbooks and cooking pamphlets, but she is best known for her collection <em>Mrs. Rorer's New Cook Book: A Manual of Housekeeping</em> (1902). Rorer died in December 1937.</p>","Richboro, PA",Bucks County,,"<a href=""https://catalog.libraries.psu.edu/?f[all_authors_facet][]=Rorer%2C+S.+T.%2C+1849-1937"" target=""_blank"">PSU Catalog Link</a>","<a href=""https://pabook.libraries.psu.edu/literary-cultural-heritage-map-pa/bios/Rorer__Sarah_Tyson"" target=""_blank"">Expanded Biography</a>",https://pabook.libraries.psu.edu/sites/default/files/biosimages/Rorer__Sarah_Tyson.jpg,40.215109,-75.010724,Photo Credit: Good Cooking by Mrs. S. T. Rorer. ca. 1898. Frontispiece. Licensed under Fair Use. Cropped to 4x3. Source: Curtis Publishing/Doubleday & McClure Co.. Source: Online Resource. Philadelphia/New York.Source: https://www.rabelaisbooks.com/pictures/5132a.jpg?v=1531600852.,,"Richboro, PA | Bucks County | <a href=""https://pabook.libraries.psu.edu/literary-cultural-heritage-map-pa/bios/Rorer__Sarah_Tyson"" target=""_blank"">Expanded Biography</a>","<a href=""https://catalog.libraries.psu.edu/?f[all_authors_facet][]=Rorer%2C+S.+T.%2C+1849-1937"" target=""_blank"">PSU Catalog Link</a>"
Liz Rosenberg,Children's,Children's | Poetry,02/03/1975,1/1/2050,Born: 2/3/1955,"<p>Liz Rosenberg is best known for her work as a children's book author and her accomplishments in poetry. Her poetry collections have won many prizes, including the Claudia Lewis Poetry Prize and the Patterson Prize, and her long list of children's books and young adult novels have earned great commercial success. Equally committed to teaching as to writing, Rosenberg has taught all over the world and at colleges throughout the US. In 1984, she received the Chancellor's Award for Excellence in Teaching and, at the time of this writing, teaches as a full Professor of English at the State University of New York at Binghamton (SUNY - Binghamton).</p>","Lanesboro, PA",Susquehanna County,,"<a href=""https://catalog.libraries.psu.edu/?f[all_authors_facet][]=Rosenberg%2C+Liz"" target=""_blank"">PSU Catalog Link</a>","<a href=""https://pabook.libraries.psu.edu/literary-cultural-heritage-map-pa/bios/Rosenberg__Liz"" target=""_blank"">Expanded Biography</a>",https://pabook.libraries.psu.edu/sites/default/files/biosimages/Rosenberg__Liz.jpg,41.957026,-75.584904,"Photo Credit: Binghamton University. Liz Rosenberg, Professor. Photograph. Licensed under Fair Use. Cropped to 4x3. Source: Online Resource. Source: https://www.binghamton.edu/img/hi-res/directory/lrosenb.jpg?resolution=200.",,"Lanesboro, PA | Susquehanna County | <a href=""https://pabook.libraries.psu.edu/literary-cultural-heritage-map-pa/bios/Rosenberg__Liz"" target=""_blank"">Expanded Biography</a>","<a href=""https://catalog.libraries.psu.edu/?f[all_authors_facet][]=Rosenberg%2C+Liz"" target=""_blank"">PSU Catalog Link</a>"
Helen Ruggieri,Poetry,Poetry,08/30/1958,1/1/2050,Born: 8/30/1938,"<p>Born on August 30, 1938, in South Plainfield, New Jersey, Helen Ruggieri has worked as both an editor and a publisher, and for over twenty years, she has also taught at the University of Pittsburgh, Bradford Campus. Ruggieri's poetry encompasses many diverse themes, including the feeling of being a foreigner, growing up in Pennsylvania, and observing the natural world.</p>","Peckville, PA",Lackawanna County,,"<a href=""https://catalog.libraries.psu.edu/?f[all_authors_facet][]=Ruggieri%2C+Helen%2C+1938-"" target=""_blank"">PSU Catalog Link</a>","<a href=""https://pabook.libraries.psu.edu/literary-cultural-heritage-map-pa/bios/Ruggieri__Helen"" target=""_blank"">Expanded Biography</a>",https://pabook.libraries.psu.edu/sites/default/files/biosimages/Ruggieri__Helen.jpg,41.480038,-75.577498,Photo Credit: Photograph of Helen Ruggieri. Photograph. Licensed under Fair Use. Cropped to 4x3. Source: Online Resource. Source: http://helenruggieri.com/wp-content/uploads/2013/11/406987_3105654077036_1134782511_3099002_1197901094_n-2.jpg.,,"Peckville, PA | Lackawanna County | <a href=""https://pabook.libraries.psu.edu/literary-cultural-heritage-map-pa/bios/Ruggieri__Helen"" target=""_blank"">Expanded Biography</a>","<a href=""https://catalog.libraries.psu.edu/?f[all_authors_facet][]=Ruggieri%2C+Helen%2C+1938-"" target=""_blank"">PSU Catalog Link</a>"
Helen Ross Russell,Children's,Children's,02/21/1935,11/7/2014,2/21/1915 - 11/7/2014,"<p>Science and education writer Helen Ross Russell was born in Lebanon County in 1915. Educated at Lebanon Valley College and Cornell University, Russell embarked on a collegiate-level academic career until 1966 when she left Fitchburg State College to pursue her writing. She is best known for her<em> Ten Minute Field Trips: Using the School Grounds for Environmental Studies </em>(1972)<em> - </em>a book that has gone into multiple printings. She died in 2014.</p>","Annville, PA",Lebanon County,,"<a href=""https://catalog.libraries.psu.edu/?f[all_authors_facet][]=Russell%2C+Helen+Ross%2C+1915-"" target=""_blank"">PSU Catalog Link</a>","<a href=""https://pabook.libraries.psu.edu/literary-cultural-heritage-map-pa/bios/Russell__Helen_Ross"" target=""_blank"">Expanded Biography</a>",https://pabook.libraries.psu.edu/sites/default/files/biosimages/Russell__Helen_Ross.jpg,40.330556,-76.514465,"Photo Credit: Foraging for Dinner: Collecting and Cooking Wild Foods. ca. 1975. Cover Copy. Licensed under Fair Use. Cropped to 4x3. Source: Thomas Nelson. Source: Online Resource. Source: https://images-na.ssl-images-amazon.com/images/I/61h7CMRnaoL._SX346_BO1,204,203,200_.jpg.",,"Annville, PA | Lebanon County | <a href=""https://pabook.libraries.psu.edu/literary-cultural-heritage-map-pa/bios/Russell__Helen_Ross"" target=""_blank"">Expanded Biography</a>","<a href=""https://catalog.libraries.psu.edu/?f[all_authors_facet][]=Russell%2C+Helen+Ross%2C+1915-"" target=""_blank"">PSU Catalog Link</a>"
