Common Name,Primary Genre,Combined Genres,TimeBirth,TimeDeath,Birth-Death Text,Abstract,City Text,County text,Personal Website,PSU Catalog Link - HTML,Expanded Biography,PIC_URL,Latitude,Longitude,Photo Credit,Alt Text,City | County | Bio Link,PSU Link | Personal Website
Floyd Cooper,Children's,Children's,01/08/1956,7/16/2021,1/8/1956-7/16/2021,"<p>Artist Floyd Cooper (1956-2021) was born in Tulsa, Oklahoma, was educated at the University of Oklahoma, and became a prominent illustrator and author of children’s books during the 1990s. After living and working in the New York area, Cooper and his family moved to Forks Township, Northampton County, Pennsylvania, where he continued to create memorable works including the Caldecott-honored <em>Unspeakable: The Tulsa Race Massacre</em> (2021). Cooper remains especially known for his portrayal of contemporary and historical African Americans, which he depicted with pathbreaking emotional depth and range.</p>","Forks Township, PA",Northampton County,,"<a href=""https://catalog.libraries.psu.edu/?f[all_authors_facet][]=Cooper%2C+Floyd"" target=""_blank"">PSU Catalog Link</a>","<a href=""https://pabook.libraries.psu.edu/cooper__floyd_donald"" target=""_blank"">Expanded Biography</a>",https://pabook.libraries.psu.edu/sites/default/files/biosimages/Cooper_Floyd.jpg,40.70211364,-75.27012254,Photo Credit: Jacob Bickenstaff. Floyd Cooper. Photograph. Licensed under Fair Use. Cropped to 4x3. Source: Kirkus. Source: Online Source. Source: https://d2i1eo516w03f2.cloudfront.net/blog/lead_art/Jul_19_Seen_Cooper_c_Jacob_Bickenstaff_CROP.jpg.,,"Forks Township, PA | Northampton County | <a href=""https://pabook.libraries.psu.edu/cooper__floyd_donald"" target=""_blank"">Expanded Biography</a>","<a href=""https://catalog.libraries.psu.edu/?f[all_authors_facet][]=Cooper%2C+Floyd"" target=""_blank"">PSU Catalog Link</a>"
Chief Cornplanter,Oral Tradition,Oral Tradition,01/01/1760,2/18/1836,ca. 1740 - 2/18/1836,"<p><strong>Photo Credit: </strong>F. Bartoli. ""<a href=""https://upload.wikimedia.org/wikipedia/commons/3/30/Cornplanter.jpg"">Ki-On-Twog-Ky (also known as Cornplanter), 1732/40-1836.</a>"" ca. 1796. Portrait. Licensed under <a href=""https://creativecommons.org/publicdomain/mark/1.0/deed.en"">Public Domain</a>. Cropped to 4x3. Source: Wikimedia Commons. </p>","Warren, PA",Warren County,,"<a href=""https://catalog.libraries.psu.edu/?f[all_authors_facet][]=Cornplanter,+Seneca+chief,+1732?-1836"" target=""_blank"">PSU Catalog Link</a>",,https://pabook.libraries.psu.edu/sites/default/files/biosimages/Cornplanter.jpg,41.996622,-78.941909,"Photo Credit: F. Bartoli. Ki-On-Twog-Ky (also known as Cornplanter), 1732/40-1836. ca. 1796. Portrait. Licensed under Public Domain. Cropped to 4x3. Source: Wikimedia Commons. Source: https://upload.wikimedia.org/wikipedia/commons/3/30/Cornplanter.jpg.",,"Warren, PA | Warren County","<a href=""https://catalog.libraries.psu.edu/?f[all_authors_facet][]=Cornplanter,+Seneca+chief,+1732?-1836"" target=""_blank"">PSU Catalog Link</a>"
PJ Corso,Poetry,Poetry | Fiction,05/28/1975,1/1/2050,Born: 5/28/1955,"<p>Paola Corso was born in the Pittsburgh area where her Italian immigrant family found work in the steel mill. A New York Foundation for the Arts Poetry fellow and Sherwood Anderson Fiction Award winner, she is the author of <em>Catina's Haircut: A Novel in Stories</em> on Library Journal's notable list of first novels in Fall 2010; <em>Giovanna's 86 Circles And Other Stories</em> (2005), a John Gardner Fiction Book Award Finalist; and books of poems:<em> Death by Renaissance </em>(2004); <em>Once I Was Told the Air Was Not for Breathing </em>(2012); and <em>The Laundress Catches Her Breath</em> (2012), winner of the Tillie Olsen Award for Creative Writing from the Working Class Studies Association. At the time of this writing, she lives in Pittsburgh after living in New York City for nearly 20 years and is a Lecturer in Chatham University's MFA Program in Creative Writing. She is married to Michael Winks, and together they have two sons, Giona and Mario.</p>","Tarentum, PA",Allegheny County,http://www.paolacorso.com/,"<a href=""https://catalog.libraries.psu.edu/?f[all_authors_facet][]=Corso%2C+Paola"" target=""_blank"">PSU Catalog Link</a>","<a href=""https://pabook.libraries.psu.edu/literary-cultural-heritage-map-pa/bios/Corso__Paola"" target=""_blank"">Expanded Biography</a>",https://pabook.libraries.psu.edu/sites/default/files/biosimages/Corso__Paola.jpg,40.601456,-79.759771,Photo Credit: Photograph of PJ Corso. Photograph. Licensed under Fair Use. Cropped to 4x3. Source: Online Resource. Source: http://www.paolacorso.com/index_htm_files/1119.jpg.,,"Tarentum, PA | Allegheny County | <a href=""https://pabook.libraries.psu.edu/literary-cultural-heritage-map-pa/bios/Corso__Paola"" target=""_blank"">Expanded Biography</a>","<a href=""https://catalog.libraries.psu.edu/?f[all_authors_facet][]=Corso%2C+Paola"" target=""_blank"">PSU Catalog Link</a> | <a href=""http://www.paolacorso.com/"" target=""_blank"">Personal Website</a>"
Gerald Costanzo,Poetry,Poetry | Other,04/28/1965,1/1/2050,Born: 4/28/1945,"<p>Gerald Costanzo was born in 1945 to James and Verna in Portland, Oregon. A graduate of Harvard University and Johns Hopkins University, Costanzo founded and at this time is the director of the Carnegie Mellon University Press, a leading publisher of contemporary poetry. At the time of this writing, Costanzo is a Professor of English at Carnegie Mellon University and has published more than three hundred poems, articles, and literary essays as well as his own poetry collections.</p>","Mount Lebanon, PA",Allegheny County,,"<a href=""https://catalog.libraries.psu.edu/?f[all_authors_facet][]=Costanzo%2C+Gerald"" target=""_blank"">PSU Catalog Link</a>","<a href=""https://pabook.libraries.psu.edu/literary-cultural-heritage-map-pa/bios/Costanzo__Gerald"" target=""_blank"">Expanded Biography</a>",https://pabook.libraries.psu.edu/sites/default/files/biosimages/Costanzo__Gerald.jpg,40.39012,-80.053034,"Photo Credit: Carnegie Mellon University. Gerlad Constanzo, Professor of English. Photograph. Licensed under Fair Use. Cropped to 4x3. Source: Online Resource. Source: https://www.cmu.edu/dietrich/english/people/faculty/bios/2018headshots/jerry-costanzo.JPG.",,"Mount Lebanon, PA | Allegheny County | <a href=""https://pabook.libraries.psu.edu/literary-cultural-heritage-map-pa/bios/Costanzo__Gerald"" target=""_blank"">Expanded Biography</a>","<a href=""https://catalog.libraries.psu.edu/?f[all_authors_facet][]=Costanzo%2C+Gerald"" target=""_blank"">PSU Catalog Link</a>"
Malcolm Cowley,Other,Other | Poetry,08/24/1918,3/27/1989,8/24/1898 - 3/27/1989,"<p>Born in Belsano, Pennsylvania, and raised in Pittsburgh, Malcolm Cowley became the preeminent American literary critic and editor of his lifetime. His analysis and editing of William Faulkner's work established Faulkner as a great American writer and saved his work from obscurity. Cowley was himself an accomplished poet and essayist whose work was awarded the Harriet Monroe Memorial Prize for Poetry and the National Book Award.</p>","Belsano, PA",Cambria County,,"<a href=""https://catalog.libraries.psu.edu/?f[all_authors_facet][]=Cowley%2C+Malcolm%2C+1898-1989"" target=""_blank"">PSU Catalog Link</a>","<a href=""https://pabook.libraries.psu.edu/literary-cultural-heritage-map-pa/bios/Cowley__Malcolm"" target=""_blank"">Expanded Biography</a>",https://pabook.libraries.psu.edu/sites/default/files/biosimages/Cowley__Malcolm.jpg,40.52571,-78.88632,"Photo Credit: Malcolm Cowley, March 26, 1963. 26 Mar 1963. Photograph. Licensed under Public Domain. Cropped to 4x3. Source: Library of Congress. Van Vechten Collection.. Source: Wikimedia Commons. Source: https://upload.wikimedia.org/wikipedia/commons/a/ab/Malcolm_Cowley.jpg.",,"Belsano, PA | Cambria County | <a href=""https://pabook.libraries.psu.edu/literary-cultural-heritage-map-pa/bios/Cowley__Malcolm"" target=""_blank"">Expanded Biography</a>","<a href=""https://catalog.libraries.psu.edu/?f[all_authors_facet][]=Cowley%2C+Malcolm%2C+1898-1989"" target=""_blank"">PSU Catalog Link</a>"
James Gould Cozzens,Fiction,Fiction | Nonfiction,08/19/1923,8/9/1978,8/19/1903 - 8/9/1978,"<p>James Gould Cozzens was born on August 19, 1903, in Chicago, Illinois.<strong> </strong>He<strong> </strong>attended Kent Prep School and later Harvard University in 1922. He married Sylvia Bernice Baumgarten in 1927. Cozzens won the 1949 Pulitzer Prize for <em>Guard of Honor</em> (1948) and was a prolific writer, penning <em>The Just and Unjust</em> (1942), <em>By Loved Possessed</em> (1956), and others. He conducted much of his research in the Doylestown Courtroom in Bucks County, Pennsylvania for <em>The Just and the Unjust</em>. He served as an Air Force Officer during World War II. Cozzens suffered depression later in life and died on June 22, 1978, from pneumonia in Stuart, Florida.</p>","Doylestown, PA",Bucks County,,"<a href=""https://catalog.libraries.psu.edu/?f[all_authors_facet][]=Cozzens%2C+James+Gould%2C+1903-1978"" target=""_blank"">PSU Catalog Link</a>","<a href=""https://pabook.libraries.psu.edu/literary-cultural-heritage-map-pa/bios/Cozzens__James_Gould"" target=""_blank"">Expanded Biography</a>",https://pabook.libraries.psu.edu/sites/default/files/biosimages/Cozzens__James_Gould.jpg,40.312268,-75.131504,"Photo Credit: National Book Foundation. James Gould Cozzens. Finalist, 1958 National Book Awards. Photograph. Licensed under Fair Use. Cropped to 4x3. Source: Online Resource. Source: https://i2.wp.com/www.nationalbook.org/wp-content/uploads/2015/08/1958_James-Gould-Cozzens.jpg?fit=228%2C285&ssl=1.",,"Doylestown, PA | Bucks County | <a href=""https://pabook.libraries.psu.edu/literary-cultural-heritage-map-pa/bios/Cozzens__James_Gould"" target=""_blank"">Expanded Biography</a>","<a href=""https://catalog.libraries.psu.edu/?f[all_authors_facet][]=Cozzens%2C+James+Gould%2C+1903-1978"" target=""_blank"">PSU Catalog Link</a>"
Margaret Maze Craig,Children's,Children's,01/16/1931,12/5/1964,1/16/1911 - 12/5/1964,"<p>Born in 1911 in Ridgway, Pennsylvania, Margaret Maze Craig not only became a successful novelist, but she was also involved in several women's organizations. She was also recognized for her accomplishments as a teacher of Home Economics and was named one of the top ten Homemaking Teachers of the Year in <em>Seventeen</em> in 1962. Her books were published all over the world, such as in Japan, Germany, and Sweden. She died in 1964.</p>","Ridgway, PA",Elk County,,"<a href=""https://catalog.libraries.psu.edu/?f[all_authors_facet][]=Craig%2C+Margaret+Maze"" target=""_blank"">PSU Catalog Link</a>","<a href=""https://pabook.libraries.psu.edu/literary-cultural-heritage-map-pa/bios/Craig__Margaret_Maze"" target=""_blank"">Expanded Biography</a>",https://pabook.libraries.psu.edu/sites/default/files/biosimages/Craig__Margaret_Maze.jpg,41.416236,-78.730152,Photo Credit: Trish. ca. 1951. Cover Copy. Licensed under Fair Use. Cropped to 4x3. Source: Berkley. Source: Online Resource. Source: https://images.gr-assets.com/books/1330633427l/13506942.jpg.,,"Ridgway, PA | Elk County | <a href=""https://pabook.libraries.psu.edu/literary-cultural-heritage-map-pa/bios/Craig__Margaret_Maze"" target=""_blank"">Expanded Biography</a>","<a href=""https://catalog.libraries.psu.edu/?f[all_authors_facet][]=Craig%2C+Margaret+Maze"" target=""_blank"">PSU Catalog Link</a>"
Jim Cramer,Nonfiction,Nonfiction,01/10/1975,1/1/2050,Born: 1/10/1955,"<p>Jim Cramer was born on February 10, 1955, in Wyndmoor, Pennsylvania. He graduated from Harvard in 1977 as a journalist. He eventually went back to Harvard for a law degree which he completed in 1984. He decided that being a prosecutor was not his future and attended a summer program at Goldman Sachs. He became a broker there and eventually started his own hedge fund company and retired 14 years later in 2001. In 1996, he started TheStreet.com, and eventually got his own show on CNBC, <em>Mad Money with Jim Cramer</em>. Cramer is also the author of several financial books.</p>","Wyndmoor, PA",Montgomery County,,"<a href=""https://catalog.libraries.psu.edu/?f[all_authors_facet][]=Cramer%2C+Jim"" target=""_blank"">PSU Catalog Link</a>","<a href=""https://pabook.libraries.psu.edu/literary-cultural-heritage-map-pa/bios/Cramer__Jim"" target=""_blank"">Expanded Biography</a>",https://pabook.libraries.psu.edu/sites/default/files/biosimages/Cramer__James.jpg,40.095937,-75.198927,"Photo Credit: Tulane Public Relations. CNBC’s “Mad Money with Jim Cramer” came to Tulane University’s Freeman School of Business Oct. 19, 2010 to broadcast in front of a live audience as part of the show’s “Back to School Tour.”. 9 Oct 2010. Photograph. Licensed under CC BY-SA 2.0. Cropped to 4x3. Source: Wikimedia Commons. Source: https://commons.wikimedia.org/w/index.php?title=Special:Search&redirs=0&search=Jim%20Cramer&fulltext=Search&ns0=1&ns6=1&ns14=1&title=Special:Search&advanced=1&fulltext=Advanced%20search#/media/File:Jimcramerphoto.jpg.",,"Wyndmoor, PA | Montgomery County | <a href=""https://pabook.libraries.psu.edu/literary-cultural-heritage-map-pa/bios/Cramer__Jim"" target=""_blank"">Expanded Biography</a>","<a href=""https://catalog.libraries.psu.edu/?f[all_authors_facet][]=Cramer%2C+Jim"" target=""_blank"">PSU Catalog Link</a>"
Barbara Crooker,Poetry,Poetry,11/21/1965,1/1/2050,Born: 11/21/1945,"<p>Barbara Crooker was born in Cold Spring, New York, in 1945, and currently resides in Fogelsville, Pennsylvania. She began writing poetry in the late 1970s. Her poetry, for which she has won many awards, incorporates themes of nature, home, family, love, loss, and disability. Over 700 of her poems have been published in anthologies and magazines, as well as compiled in several chapbooks and books, including <em>The Lost Children</em> (1989), <em>Ordinary Life </em>(2001), <em>Radiance</em> (2005), <em>Line Dance </em>(2008), and <em>More</em> (2010). Crooker continues to write, read her poetry, teach workshops, and speak about the venues available for publishing poetry.</p>","Fogelsville, PA",Lehigh County,https://www.barbaracrooker.com/,"<a href=""https://catalog.libraries.psu.edu/?f[all_authors_facet][]=Crooker%2C+Barbara%2C+1945-"" target=""_blank"">PSU Catalog Link</a>","<a href=""https://pabook.libraries.psu.edu/literary-cultural-heritage-map-pa/bios/Crooker__Barbara"" target=""_blank"">Expanded Biography</a>",https://pabook.libraries.psu.edu/sites/default/files/biosimages/Crooker__Barbara.jpg,40.597746,-75.63447,Photo Credit: Barbara Crooker. Photograph of Barbara Crooker. Photograph. Licensed under Fair Use. Cropped to 4x3. Source: Online Resource. Source: https://www.barbaracrooker.com/images/home.jpg.,,"Fogelsville, PA | Lehigh County | <a href=""https://pabook.libraries.psu.edu/literary-cultural-heritage-map-pa/bios/Crooker__Barbara"" target=""_blank"">Expanded Biography</a>","<a href=""https://catalog.libraries.psu.edu/?f[all_authors_facet][]=Crooker%2C+Barbara%2C+1945-"" target=""_blank"">PSU Catalog Link</a> | <a href=""https://www.barbaracrooker.com/"" target=""_blank"">Personal Website</a>"
Evelyn Cunningham,Journalism,Journalism,1/25/1936,4/28/2010,1/25/1916 - 4/28/2010,"<p>Journalist and activist Evelyn Cunningham wrote for the <em>Pittsburgh Courier</em> from its Harlem office for many years. She covered the civil rights movement extensively, and primarily shed light on the struggles of African Americans, women, and those living in poverty. Cunningham was seated at the head of at least 14 government commissions and boards to advise politicians and policymakers about their approach to securing equal rights for these groups. Read more <a href=""https://libraries.psu.edu/about/collections/few-good-women/evelyn-cunningham"" target=""_blank"">here</a></p><p>""Evelyn Cunningham."" <em>Penn State University Libraries.</em> 24 June 2020.</p>","Pittsburgh, PA",Allegheny County,,,,https://pabook.libraries.psu.edu/sites/default/files/biosimages/Cunningham__Evelyn.jpg,40.44674,-79.96774,Photo Credit: National Visionary Leadership Project. Screen Capture of Evelyn Cunningham. 27 Apr 2010. Screen Capture. Licensed under Fair Use. Cropped to 4x3. Source: Online Resource. Source: http://www.visionaryproject.org/cunninghamevelyn.,,"Pittsburgh, PA | Allegheny County",
Cyrus H.K. Curtis,Other,Other,06/18/1870,6/7/1933,6/18/1850 - 6/7/1933,"<p>Cyrus Curtis was a well-accomplished magazine and newspaper publisher who was born in Portland, Maine, on June 18, 1850. Curtis started his career in magazine publishing at the age of 15, when he became founder of <em>Young America</em>. After moving to Boston and then Philadelphia, Curtis purchased the <em>Saturday Evening Post </em>in 1897 and founded the Curtis Publishing Company. Soon after the purchase of the <em>Saturday Evening Post</em>, Curtis and his wife, Louisa Knapp, founded the <em>Ladies' Home Journal</em>, which is still in circulation. Curtis then shifted his interests from magazine publishing to newspaper publishing; however, Curtis did not succeed in newspaper publishing and had to sell his newspapers after losing money. Cyrus Curtis died on June 7, 1933, at his home in Wyncote, Pennsylvania. He is survived by his daughter, Mary Louise Bok Zimbalist, who has founded the Curtis Center and Curtis Institute of Music in Philadelphia, all named in honor of Cyrus Curtis.</p>","Wyncote, PA",Montgomery County,,,"<a href=""https://pabook.libraries.psu.edu/literary-cultural-heritage-map-pa/bios/Curtis__Cyrus"" target=""_blank"">Expanded Biography</a>",https://pabook.libraries.psu.edu/sites/default/files/biosimages/Curtis__Cyrus.jpg,40.08693,-75.14942,"Photo Credit: Bain News Service, LOC. Cyrus H.K. Curtis. ca. 1915. Photograph. Licensed under Public Domain. Cropped to 4x3. Source: Library of Congress. George Grantham Bain Collection. Source: Flickr. Source: https://www.flickr.com/photos/library_of_congress/34336438361/in/photostream/.",,"Wyncote, PA | Montgomery County | <a href=""https://pabook.libraries.psu.edu/literary-cultural-heritage-map-pa/bios/Curtis__Cyrus"" target=""_blank"">Expanded Biography</a>",
Craig Czury,Poetry,Poetry,03/10/1971,1/1/2050,Born: 3/10/1951,"<p>Born in Kingston, Pennsylvania, in 1951, Craig Czury is a contemporary poet and translator who grew up during the economic decline of the northeastern Pennsylvania coal mining region. Much of the inspiration for his poetry came from this depression-stricken area. Czury has written over 20 poetry collections, including <em>Janus Peeking</em> (1980), <em>God's Shiny Glass Eye</em> (1987), and <em>Fifteen Stories</em> (2017). He has taught poetry in schools, prisons, homeless shelters, and community centers. At the time of this writing, Craig Czury splits his time between Springville, Pennsylvania, and Soncino, Italy.</p>","Springville, PA",Susquehanna County,https://www.craigczury.com/,"<a href=""https://catalog.libraries.psu.edu/?f[all_authors_facet][]=Czury%2C+Craig"" target=""_blank"">PSU Catalog Link</a>","<a href=""https://pabook.libraries.psu.edu/literary-cultural-heritage-map-pa/bios/Czury__Craig"" target=""_blank"">Expanded Biography</a>",https://pabook.libraries.psu.edu/sites/default/files/biosimages/Czury__Craig.jpg,41.686085,-75.914693,"Photo Credit: Aldo Villagrossi. The poet Craig Czury in Springville, Pennsylvania. 9 Dec 2012. Photograph. Licensed under CC BY-SA 4.0. Cropped to 4x3. Source: Wikimedia Commons. Source: https://commons.wikimedia.org/w/index.php?title=Special:Search&redirs=0&search=Craig%20Czury&fulltext=Search&ns0=1&ns6=1&ns14=1&title=Special:Search&advanced=1&fulltext=Advanced%20search#/media/File:Craig_Czury.jpg.",,"Springville, PA | Susquehanna County | <a href=""https://pabook.libraries.psu.edu/literary-cultural-heritage-map-pa/bios/Czury__Craig"" target=""_blank"">Expanded Biography</a>","<a href=""https://catalog.libraries.psu.edu/?f[all_authors_facet][]=Czury%2C+Craig"" target=""_blank"">PSU Catalog Link</a> | <a href=""https://www.craigczury.com/"" target=""_blank"">Personal Website</a>"
Thomas Augustine Daly,Poetry,Poetry | Nonfiction,05/28/1891,10/4/1948,5/28/1871 - 10/4/1948,"<p>Born in 1871, Thomas Augustine Daly was known as a humorist, poet, and journalist. Some of his most popular poems include titles such as ""Between Two Loves"" (1909), ""Mia Carlotta"" (1909),""Da Comica Man"" (1906), and ""Da Leetla Boy"" (1909). He also created famous books of poems, such as <em>Canzoni</em> (1906) and <em>Songs of Wedlock </em> (1916). Daly spent most of his life as a newspaper column/editorial writer. He started off as a young reporter and developed into a successful poet and writer. Daly died in his native Philadelphia in 1948.</p>","Philadelphia, PA",Philadelphia County,,"<a href=""https://catalog.libraries.psu.edu/?f[all_authors_facet][]=Daly%2C+T.+A.+(Thomas+Augustine)%2C+1871-1948"" target=""_blank"">PSU Catalog Link</a>","<a href=""https://pabook.libraries.psu.edu/literary-cultural-heritage-map-pa/bios/Daly_Thomas_Augustine"" target=""_blank"">Expanded Biography</a>",https://pabook.libraries.psu.edu/sites/default/files/biosimages/Daly_Thomas_Augustine.jpg,39.971983,-75.218262,Photo Credit: Photograph of Thomas Augustine Daly. Photograph. Licensed under Fair Use. Cropped to 4x3. Source: Online Resource. Source: https://images.findagrave.com/photos/2008/97/19061_120762192893.jpg.,,"Philadelphia, PA | Philadelphia County | <a href=""https://pabook.libraries.psu.edu/literary-cultural-heritage-map-pa/bios/Daly_Thomas_Augustine"" target=""_blank"">Expanded Biography</a>","<a href=""https://catalog.libraries.psu.edu/?f[all_authors_facet][]=Daly%2C+T.+A.+(Thomas+Augustine)%2C+1871-1948"" target=""_blank"">PSU Catalog Link</a>"
Jim Daniels,Poetry,Poetry,09/01/1976,1/1/2050,Born: 9/1/1956,"<p>Born in Detroit, Michigan in 1956, Jim Daniels worked in factories before graduating from Alma College in 1978. The factories proved a setting for many of his poems, which describe the hardships factory workers face. He has won several awards for his poems. At the time of this writing, he resides with his family in Pittsburgh where he teaches at Carnegie Mellon University.</p>","Pittsburgh, PA",Allegheny County,,"<a href=""https://catalog.libraries.psu.edu/?f[all_authors_facet][]=Daniels%2C+Jim"" target=""_blank"">PSU Catalog Link</a>","<a href=""https://pabook.libraries.psu.edu/literary-cultural-heritage-map-pa/bios/Daniels__Jim"" target=""_blank"">Expanded Biography</a>",https://pabook.libraries.psu.edu/sites/default/files/biosimages/Daniels__Jim.jpg,40.441541,-79.94519,Photo Credit: Photograph of Jim Daniels. Photograph. Licensed under Fair Use. Cropped to 4x3. Source: Online Resource. Source: https://www.cmu.edu/dietrich/english/people/faculty/bios/2018headshots/jim-daniels.jpg.,,"Pittsburgh, PA | Allegheny County | <a href=""https://pabook.libraries.psu.edu/literary-cultural-heritage-map-pa/bios/Daniels__Jim"" target=""_blank"">Expanded Biography</a>","<a href=""https://catalog.libraries.psu.edu/?f[all_authors_facet][]=Daniels%2C+Jim"" target=""_blank"">PSU Catalog Link</a>"
Iris Rainer Dart,Fiction,Fiction,03/03/1964,1/1/2050,Born: 3/3/1944,"<p>Iris Rainer Dart was raised in Pittsburgh, Pennsylvania. After attending Carnegie Mellon University, Dart moved to California where she began working in television, most notably the <em>Sonny and Cher Show</em>. Her novels often have a focus on the entertainment business, which reflects many of her life experiences. She became famous for her novel <em>Beaches </em>(1985), which was subsequently made into a popular film starring Bette Midler.</p>","Pittsburgh, PA",Allegheny County,,"<a href=""https://catalog.libraries.psu.edu/?f[all_authors_facet][]=Dart%2C+Iris+Rainer"" target=""_blank"">PSU Catalog Link</a>","<a href=""https://pabook.libraries.psu.edu/literary-cultural-heritage-map-pa/bios/Dart__Iris_Rainer"" target=""_blank"">Expanded Biography</a>",https://pabook.libraries.psu.edu/sites/default/files/biosimages/Dart__Iris_Rainer.jpg,40.42955,-79.919164,Photo Credit: Beaches. ca. 2004. Cover Copy. Licensed under Fair Use. Cropped to 4x3. Source: William Morrow Paperbacks. Source: Online Resource. Source: https://images.gr-assets.com/books/1490973062l/1219954.jpg.,,"Pittsburgh, PA | Allegheny County | <a href=""https://pabook.libraries.psu.edu/literary-cultural-heritage-map-pa/bios/Dart__Iris_Rainer"" target=""_blank"">Expanded Biography</a>","<a href=""https://catalog.libraries.psu.edu/?f[all_authors_facet][]=Dart%2C+Iris+Rainer"" target=""_blank"">PSU Catalog Link</a>"
