Common Name,Primary Genre,Combined Genres,TimeBirth,TimeDeath,Birth-Death Text,Abstract,City Text,County text,Personal Website,PSU Catalog Link - HTML,Expanded Biography,PIC_URL,Latitude,Longitude,Photo Credit,Alt Text,City | County | Bio Link,PSU Link | Personal Website
Bil Keane,Graphic/Comic,Graphic/Comic,10/05/1942,11/8/2011,10/5/1922 - 11/8/2011,"<p>Born in Philadelphia on October 5, 1922, Bil Keane was a self-taught cartoonist who was best known for <em>The Family Circus. </em>His family, consistedof wife Thel (married in 1948), sons Neal, Glen, Christopher, and Jeff, and daughter Gayle, were his inspiration. He died on November 8, 2011 in his home.</p>","Philadelphia, PA",Philadelphia County,,"<a href=""https://catalog.libraries.psu.edu/?f[all_authors_facet][]=Keane%2C+Bil%2C+1922-2011"" target=""_blank"">PSU Catalog Link</a>","<a href=""https://pabook.libraries.psu.edu/literary-cultural-heritage-map-pa/bios/Keane__Bil"" target=""_blank"">Expanded Biography</a>",https://pabook.libraries.psu.edu/sites/default/files/biosimages/Keane__Bil.jpg,40.047759,-75.113296,Photo Credit: Christopher Keane. Photograph of Bil Keane. ca. 1990. Photograph. Licensed under CC BY-SA 3.0. Cropped to 4x3. Source: Wikimedia Commons. Source: https://upload.wikimedia.org/wikipedia/commons/7/7f/Bil_Keane_%281990%29.jpg.,,"Philadelphia, PA | Philadelphia County | <a href=""https://pabook.libraries.psu.edu/literary-cultural-heritage-map-pa/bios/Keane__Bil"" target=""_blank"">Expanded Biography</a>","<a href=""https://catalog.libraries.psu.edu/?f[all_authors_facet][]=Keane%2C+Bil%2C+1922-2011"" target=""_blank"">PSU Catalog Link</a>"
Sally M. Keehn,Children's,Children's,08/10/1967,1/1/2050,Born: 8/10/1947,"<p>Sally M. Keehn was born in London, England, but grew up on her grandfather's farm in Maryland. After attending Hood College and Drexel University, she wrote a travel book on Pennsylvania Dutch country with her husband, David C. Keehn. From this experience she drew the inspiration to begin a career in writing and has gone on to write numerous historical fiction and contemporary fiction novels for young adults.</p>","Allentown, PA",Lehigh County,,"<a href=""https://catalog.libraries.psu.edu/?f[all_authors_facet][]=Keehn%2C+Sally+M."" target=""_blank"">PSU Catalog Link</a>","<a href=""https://pabook.libraries.psu.edu/literary-cultural-heritage-map-pa/bios/Keehn__Sally_M"" target=""_blank"">Expanded Biography</a>",https://pabook.libraries.psu.edu/sites/default/files/biosimages/Keehn__Sally_M.jpg,40.599131,-75.481897,"Photo Credit: Children's author and photographer, Sally M. Keehn. Photograph. Licensed under Fair Use. Cropped to 4x3. Source: Penguin Random House. Source: Online Resource. Source: http://1.bp.blogspot.com/-jiqNrt1YG4M/TkVnRRNIODI/AAAAAAAADJg/QPmpkEuNKaA/s1600/author+banner+2007_4.jpg.",,"Allentown, PA | Lehigh County | <a href=""https://pabook.libraries.psu.edu/literary-cultural-heritage-map-pa/bios/Keehn__Sally_M"" target=""_blank"">Expanded Biography</a>","<a href=""https://catalog.libraries.psu.edu/?f[all_authors_facet][]=Keehn%2C+Sally+M."" target=""_blank"">PSU Catalog Link</a>"
Jean Kerr,Nonfiction,Nonfiction | Screenwriting / Playwriting,07/10/1942,1/5/2003,7/10/1922 - 1/5/2003,"<p>Playwright and essayist Jean Kerr was born in Scranton, Pennsylvaniain 1923. After obtaining her education at Marywood College and Catholic University, she married drama professor Walter Kerr. Following a number of unsuccessful productions, she first achieved success with the musical review <em>Touch and Go</em> (1949). In 1957, Kerr achieved her greatest success with her collection of humorous essays on suburban life, <em>Please Don't Eat the Daisies</em>. She also wrote the long-running comedy <em>Mary, Mary</em> in the early 1960s. Jean Kerr died in 2003.</p>","Scranton, PA",Lackawanna County,,"<a href=""https://catalog.libraries.psu.edu/?f[all_authors_facet][]=Kerr%2C+Jean"" target=""_blank"">PSU Catalog Link</a>","<a href=""https://pabook.libraries.psu.edu/literary-cultural-heritage-map-pa/bios/Kerr__Jean"" target=""_blank"">Expanded Biography</a>",https://pabook.libraries.psu.edu/sites/default/files/biosimages/Kerr__Jean.jpg,41.435132,-75.632423,Photo Credit: Photograph of Jean Kerr. Photograph. Licensed under Fair Use. Cropped to 4x3. Source: Online Resource. Source: https://static.playbill.com/dims4/default/a420cbc/2147483647/resize/x450/quality/90/?url=http%3A%2F%2Fplaybill-brightspot.s3.amazonaws.com%2F6e%2Fa3%2Fa0486385444f95e1b9739e0818ee%2FJean-Kerr.jpg.,,"Scranton, PA | Lackawanna County | <a href=""https://pabook.libraries.psu.edu/literary-cultural-heritage-map-pa/bios/Kerr__Jean"" target=""_blank"">Expanded Biography</a>","<a href=""https://catalog.libraries.psu.edu/?f[all_authors_facet][]=Kerr%2C+Jean"" target=""_blank"">PSU Catalog Link</a>"
Kerry Shawn Keys,Poetry,Poetry | Other,06/25/1966,1/1/2050,Born: 6/25/1946,"<p>Kerry Shawn Keys was born in Harrisburg on June 25, 1946. He was a Peace Corps volunteer in South India, and later received his Master of Arts degree from Indiana University. He has taught at several colleges, including Penn State University and Dickinson College, and started the company Pine Press. His poems and works have been published in several countries.</p>","New Bloomfield, PA",Perry County,,"<a href=""https://catalog.libraries.psu.edu/?f[all_authors_facet][]=Keys%2C+Kerry+Shawn%2C+1946-"" target=""_blank"">PSU Catalog Link</a>","<a href=""https://pabook.libraries.psu.edu/literary-cultural-heritage-map-pa/bios/Keys__Kerry_Shawn"" target=""_blank"">Expanded Biography</a>",https://pabook.libraries.psu.edu/sites/default/files/biosimages/Keys__Kerry_Shawn.jpg,40.419791,-77.187205,Photo Credit: Kerry Shawn Keys. Photograph. Licensed under Fair Use. Cropped to 4x3. Source: Online Resource. Source: https://www.pw.org/files/writers/kerrykeyspoetryspringbenas2012576965_306659329419675_1833780009_n.jpg.,,"New Bloomfield, PA | Perry County | <a href=""https://pabook.libraries.psu.edu/literary-cultural-heritage-map-pa/bios/Keys__Kerry_Shawn"" target=""_blank"">Expanded Biography</a>","<a href=""https://catalog.libraries.psu.edu/?f[all_authors_facet][]=Keys%2C+Kerry+Shawn%2C+1946-"" target=""_blank"">PSU Catalog Link</a>"
Chip Kidd,Graphic/Comic,Graphic/Comic | Fiction,09/12/1984,1/1/2050,Born: 9/12/1964,"<p>Graphic designer and author Chip Kidd was born in Reading, Pennsylvania, and received his degree in graphic design from Pennsylvania State University. He initially focused on graphic design and book cover design, but soon expanded to author and edit his own graphic novels, as well. Arguably his most recognizable work is the <em>Jurassic Park</em> (1990) logo, originally the cover for the book by Michael Crichton.</p>","Shillington, PA",Berks County,https://chipkidd.com/,"<a href=""https://catalog.libraries.psu.edu/?f[all_authors_facet][]=Kidd%2C+Chip"" target=""_blank"">PSU Catalog Link</a>","<a href=""https://pabook.libraries.psu.edu/literary-cultural-heritage-map-pa/bios/Kidd__Chip"" target=""_blank"">Expanded Biography</a>",https://pabook.libraries.psu.edu/sites/default/files/biosimages/Kidd__Charles_Chip.jpg,40.30787,-75.96549,"Photo Credit: Penn State. Chip Kidd horizontal. 4 Apr 2013. Photograph. Licensed under CC BY-NC 2.0. Cropped to 4x3. Source: Flickr. University Park, PA.Source: https://bit.ly/3MgJOIq.",,"Shillington, PA | Berks County | <a href=""https://pabook.libraries.psu.edu/literary-cultural-heritage-map-pa/bios/Kidd__Chip"" target=""_blank"">Expanded Biography</a>","<a href=""https://catalog.libraries.psu.edu/?f[all_authors_facet][]=Kidd%2C+Chip"" target=""_blank"">PSU Catalog Link</a> | <a href=""https://chipkidd.com/"" target=""_blank"">Personal Website</a>"
Virginia Kidd,Other,Other | Fiction,06/02/1941,1/11/2003,6/2/1921 - 1/11/2003,"<p>Virginia Kidd was born on June 2, 1921 in the Germantown district of Philadelphia, Pennsylvania. Her father, Charles Kidd, was a printer. She attended Berlitz School of Languages, developing fluency in several languages. Virginia Kidd later became a freelance writer, ghost writer, and proofreader. However, she preferred reading to writing and decided to become a literary agent. In 1965, she established the Virginia Kidd Literary Agency. After three decades in the profession, Kidd passed away on January 11, 2003.</p>","Milford, PA",Pike County,,"<a href=""https://catalog.libraries.psu.edu/?f[all_authors_facet][]=Kidd%2C+Virginia"" target=""_blank"">PSU Catalog Link</a>","<a href=""https://pabook.libraries.psu.edu/literary-cultural-heritage-map-pa/bios/Kidd__Virginia"" target=""_blank"">Expanded Biography</a>",https://pabook.libraries.psu.edu/sites/default/files/biosimages/Kidd__Virginia.jpg,41.317358,-74.799809,"Photo Credit: Virginia Kidd Literary Agency. Ad Astra, Virginia Kidd, 1921-2003. Photograph. Licensed under Fair Use. Cropped to 4x3, Filled background. Source: Online Resource. Source: http://www.vk-agency.com/pics/vk.jpg.",,"Milford, PA | Pike County | <a href=""https://pabook.libraries.psu.edu/literary-cultural-heritage-map-pa/bios/Kidd__Virginia"" target=""_blank"">Expanded Biography</a>","<a href=""https://catalog.libraries.psu.edu/?f[all_authors_facet][]=Kidd%2C+Virginia"" target=""_blank"">PSU Catalog Link</a>"
Maurice Kilwein-Guevara,Poetry,Poetry | Screenwriting / Playwriting,11/05/1981,1/1/2050,Born: 11/5/1961,"<p>Born in Belencito, Colombia in 1961 and raised in Pittsburgh, Maurice Kilwein Guevara is an accomplished poet whose poetry explores multicultural boundaries through his own experiences. He is the recipient of various literary awards and has given poetry performances and workshops in Mexico, Colombia, Costa Rica, Spain, Cuba, and throughout the United States.</p>","Pittsburgh, PA",Allegheny County,,"<a href=""https://catalog.libraries.psu.edu/?f[all_authors_facet][]=Kilwein+Guevara%2C+Maurice"" target=""_blank"">PSU Catalog Link</a>","<a href=""https://pabook.libraries.psu.edu/literary-cultural-heritage-map-pa/bios/Kilwein-Guevara__Maurice"" target=""_blank"">Expanded Biography</a>",https://pabook.libraries.psu.edu/sites/default/files/biosimages/Kilwein-Guevara__Maurice.jpg,40.409,-79.941,"Photo Credit: Kilwein-Guevara, Mauricio - Professor. Photograph. Licensed under Fair Use. Cropped to 4x3. Source: Online Resource. Source: https://uwm.edu/english/wp-content/uploads/sites/109/2014/05/Mauricio-Guevara.png.",,"Pittsburgh, PA | Allegheny County | <a href=""https://pabook.libraries.psu.edu/literary-cultural-heritage-map-pa/bios/Kilwein-Guevara__Maurice"" target=""_blank"">Expanded Biography</a>","<a href=""https://catalog.libraries.psu.edu/?f[all_authors_facet][]=Kilwein+Guevara%2C+Maurice"" target=""_blank"">PSU Catalog Link</a>"
Margaret Mary Kimmel,Children's,Children's,05/12/1958,6/10/2014,5/12/1938 - 6/10/2014,"<p>Margaret Mary Kimmel was born in 1938 in Gary, Indiana. In college, Kimmel began her lifelong service to literature by becoming a librarian. Eventually, she moved to Pittsburgh to get her doctorate. After receiving her PhD, Kimmel remained at the University of Pittsburgh as a professor. Kimmel had also served as a consultant for <em>Mister Rogers' Neighborhood </em>and co-edited (with Mark Collins) a book about the show. Kimmel was very active in promoting literature in Pennsylvania, especially children's literature in Western Pennsylvania, and was also an advocate for people with disabilities. She died of Leukemia on June 10, 2014, at the age of 76.</p>","Pittsburgh, PA",Allegheny County,,"<a href=""https://catalog.libraries.psu.edu/?f[all_authors_facet][]=Kimmel%2C+Margaret+Mary"" target=""_blank"">PSU Catalog Link</a>","<a href=""https://pabook.libraries.psu.edu/literary-cultural-heritage-map-pa/bios/Kimmel__Margaret"" target=""_blank"">Expanded Biography</a>",https://pabook.libraries.psu.edu/sites/default/files/biosimages/Kimmel__Margaret_Mary.jpg,40.462332,-79.92575,"Photo Credit: Margaret Mary Kimmel . Photograph. Licensed under Fair Use. Cropped to 4x3, Filled background. Source: Online Resource. Source: https://cache.legacy.net/legacy/images/cobrands/postgazette/photos/photo_201244_17827928_1_17827928_20140615.jpgx?w=130&h=180&v=0x000000004c901be1&option=1.",,"Pittsburgh, PA | Allegheny County | <a href=""https://pabook.libraries.psu.edu/literary-cultural-heritage-map-pa/bios/Kimmel__Margaret"" target=""_blank"">Expanded Biography</a>","<a href=""https://catalog.libraries.psu.edu/?f[all_authors_facet][]=Kimmel%2C+Margaret+Mary"" target=""_blank"">PSU Catalog Link</a>"
William R. Kintner,Nonfiction,Nonfiction,04/21/1935,2/1/1997,4/21/1915 - 2/1/1997,"<p>William Roscoe Kintner was born April 21, 1915, in Lock Haven, Pennsylvania. A graduate of West Point in 1940, Kintner went on to earn an MA and PhD from Georgetown University. He served in the United States Army until 1961, a veteran of World War II and the Korean War. Kintner retired with the rank of Colonel. Kintner taught at the University of Pennsylvania from 1961 until retiring in 1986. During his time at Penn, he served as the deputy-director and then director of the Foreign Policy Research Institute and editor of its journal <em>Orbis.</em> He was an accomplished author on foreign affairs, writing many books on international relations, arms control and strategy, with a focus on the Cold War. Kintner continued his work in world affairs until his death in 1997 at the age of 81.</p>","Lock Haven, PA",Clinton County,,"<a href=""https://catalog.libraries.psu.edu/?f[all_authors_facet][]=Kintner,+William+R.+(William+Roscoe),+1915-1997"" target=""_blank"">PSU Catalog Link</a>","<a href=""https://pabook.libraries.psu.edu/literary-cultural-heritage-map-pa/bios/Kintner__William"" target=""_blank"">Expanded Biography</a>",https://pabook.libraries.psu.edu/sites/default/files/biosimages/Kintner__William_R_0.jpg,41.137013,-77.446926,Photo Credit: Photograph of William R. Kintner. Photograph. Licensed under Fair Use. Cropped to 4x3. Source: Unknown. ,,"Lock Haven, PA | Clinton County | <a href=""https://pabook.libraries.psu.edu/literary-cultural-heritage-map-pa/bios/Kintner__William"" target=""_blank"">Expanded Biography</a>","<a href=""https://catalog.libraries.psu.edu/?f[all_authors_facet][]=Kintner,+William+R.+(William+Roscoe),+1915-1997"" target=""_blank"">PSU Catalog Link</a>"
Jim Kjelgaard,Young Adult (YA),Young Adult (YA),12/06/1930,7/12/1959,12/6/1910 - 7/12/1959,"<p>Jim Kjelgaard was one of six children. He was born December 10, 1910 in New York, New York. He spent most of his childhood growing up on a large farm and within the Pennsylvanian mountains. He was a conservationist who loved the outdoors. Jim had a great love for animals and nature which was quite apparent in all of his writings. Jim had an especially great love for dogs. After marrying his wife in 1939, one of his greatest novels was published, <em>Big </em><em>Red </em>(1945)<em>.</em> It was a novel depicting loyalty and companionship between man and his dog. Jim won the Boys Club Award for <em>Big </em><em>Red</em> in 1948. He was also awarded the Spur Award from the Western Writers of America in 1958 for <em>Wolf Brother </em>(1957)<em></em>and the Boy's Life Award in 1959 for <em>Ulysses and His Woodland Zoo </em>(1960)<em>.</em> Jim was an inspiration for many children readers and other writers as well. Jim Kjelgaard committed suicide on July 12, 1959.</p>","Galeton, PA",Potter County,,"<a href=""https://catalog.libraries.psu.edu/?f[all_authors_facet][]=Kjelgaard%2C+Jim%2C+1910-1959"" target=""_blank"">PSU Catalog Link</a>","<a href=""https://pabook.libraries.psu.edu/literary-cultural-heritage-map-pa/bios/Kjelgaard__James"" target=""_blank"">Expanded Biography</a>",https://pabook.libraries.psu.edu/sites/default/files/biosimages/Kjelgaard__James_0.jpg,41.733125,-77.641931,Photo Credit: Photograph of Jim Kjelgaard. Photograph. Licensed under Fair Use. Cropped to 4x3. Source: Online Resource. Source: https://images.gr-assets.com/authors/1522675698p5/70978.jpg.,,"Galeton, PA | Potter County | <a href=""https://pabook.libraries.psu.edu/literary-cultural-heritage-map-pa/bios/Kjelgaard__James"" target=""_blank"">Expanded Biography</a>","<a href=""https://catalog.libraries.psu.edu/?f[all_authors_facet][]=Kjelgaard%2C+Jim%2C+1910-1959"" target=""_blank"">PSU Catalog Link</a>"
Randal Kleiser,Screenwriting / Playwriting,Screenwriting / Playwriting,07/20/1966,1/1/2050,Born: 7/20/1946,"<p>Director Randal Kleiser was born in Lebanon, PA, in 1946. After training at the University of Southern California (USC) Cinematic Arts, Kleiser performed in and directed numerous projects. He is best known for having directed the most-successful musical in movie history <em>Grease</em>, <em>The Blue Lagoon</em>, and <em>It's My Party</em>, among many others. His USC student film <em>Peege</em> was placed on the National Film Registry in 2008.</p>","Lebanon, PA",Lebanon County,https://www.randalkleiser.com/,"<a href=""https://catalog.libraries.psu.edu/?f[all_authors_facet][]=Kleiser%2C+Randal"" target=""_blank"">PSU Catalog Link</a>","<a href=""https://pabook.libraries.psu.edu/literary-cultural-heritage-map-pa/bios/Kleiser__Randal"" target=""_blank"">Expanded Biography</a>",https://pabook.libraries.psu.edu/sites/default/files/biosimages/Kleiser__Randal.jpg,40.339456,-76.422279,"Photo Credit: Photograph of Randal Kleiser. Photograph. Licensed under Fair Use. Cropped to 4x3, filled background. Source: Online Resource. Source: https://m.media-amazon.com/images/M/MV5BMjQxMDIzNjk3MF5BMl5BanBnXkFtZTgwNzc2NTc3NjE@._V1_UY1200_CR155,0,630,1200_AL_.jpg.",,"Lebanon, PA | Lebanon County | <a href=""https://pabook.libraries.psu.edu/literary-cultural-heritage-map-pa/bios/Kleiser__Randal"" target=""_blank"">Expanded Biography</a>","<a href=""https://catalog.libraries.psu.edu/?f[all_authors_facet][]=Kleiser%2C+Randal"" target=""_blank"">PSU Catalog Link</a> | <a href=""https://www.randalkleiser.com/"" target=""_blank"">Personal Website</a>"
Ruth Ellen Kocher,Poetry,Poetry,07/26/1985,1/1/2050,Born: 7/26/1965,"<p>Acclaimed poet Ruth Ellen Kocher was born in Wilkes-Barre, Pennsylvania, and earned her BA in English at Pennsylvania State University. The recipient of several awards, her poetry often centers around returning to one's roots. She is also an extensively published literary critic. Read more <a href=""https://sites.psu.edu/pablackwriters/the-writers/ruth-ellen-kocher/"" target=""_blank"">here</a></p><p>""Ruth Ellen Kocher."" <em>Black Writers of PA.</em> 2020. 31 August 2020.</p>","Wilkes-Barre, PA",Luzerne County,https://www.ruthellenkocher.org/,"<a href=""https://catalog.libraries.psu.edu/?f[all_authors_facet][]=Kocher%2C+Ruth+Ellen%2C+1965-"" target=""_blank"">PSU Catalog Link</a>","<a href=""https://pabook.libraries.psu.edu/literary-cultural-heritage-map-pa/bios/Kocher__Ruth_Ellen"" target=""_blank"">Expanded Biography</a>",https://pabook.libraries.psu.edu/sites/default/files/biosimages/Kocher__Ruth.jpg,41.240952,-75.880224,Photo Credit: Penn State. Ruth Ellen Kocher. 24 Oct 2016. Photograph. Licensed under CC BY-NC 2.0. Cropped to 4x3. Source: Flickr. Source: https://www.flickr.com/photos/pennstatelive/29913572944/in/photolist-MzmT4E-9kx5dq-gqsQDv-9ku3wx-gqsQWp.,,"Wilkes-Barre, PA | Luzerne County | <a href=""https://pabook.libraries.psu.edu/literary-cultural-heritage-map-pa/bios/Kocher__Ruth_Ellen"" target=""_blank"">Expanded Biography</a>","<a href=""https://catalog.libraries.psu.edu/?f[all_authors_facet][]=Kocher%2C+Ruth+Ellen%2C+1965-"" target=""_blank"">PSU Catalog Link</a> | <a href=""https://www.ruthellenkocher.org/"" target=""_blank"">Personal Website</a>"
Sarah Koenig,Journalism,Journalism,07/01/1988,1/1/2050,Born: 7/1/1968,"<p><strong>Photo Credit: </strong>Kenneth C. Zirkel. ""<a href=""https://upload.wikimedia.org/wikipedia/commons/0/06/Sarah_Koenig%2C_American_journalist_2015.jpg"">Journalist Sarah Koenig, of ""This American LIfe"" and ""Serial"" podcast, gives a talk in March 2015.</a>"" 30 Mar 2015. Photograph. Licensed under <a href=""https://creativecommons.org/licenses/by-sa/4.0"">CC BY-SA 4.0</a>. Cropped to 4x3, Filled background. Source: Wikimedia Commons. </p>","State College, PA",Centre County,https://serialpodcast.org/about,,,https://pabook.libraries.psu.edu/sites/default/files/biosimages/Koenig__Sarah.jpg,40.797084,-77.8516,"Photo Credit: Kenneth C. Zirkel. Journalist Sarah Koenig, of ""This American LIfe"" and ""Serial"" podcast, gives a talk in March 2015. 30 Mar 2015. Photograph. Licensed under CC BY-SA 4.0. Cropped to 4x3, Filled background. Source: Wikimedia Commons. Source: https://upload.wikimedia.org/wikipedia/commons/0/06/Sarah_Koenig%2C_American_journalist_2015.jpg.",,"State College, PA | Centre County","<a href=""https://serialpodcast.org/about"" target=""_blank"">Personal Website</a>"
Sandra Kohler,Poetry,Poetry,08/09/1960,1/1/2050,Born: 8/9/1940,"<p>Sandra Kohler is a poet and professor born in New York City on August 9, 1940. She received a PhD in English from Mount Holyoke College and Bryn Mawr College. After completing her degree, Kohler taught English classes at the Prince of Wales College and Bryn Mawr College. Kohler published many of her poems in journals before compiling her first collection of poetry, <em>The Country of Women</em>, in 1995.</p>","Selinsgrove, PA",Snyder County,,"<a href=""https://catalog.libraries.psu.edu/?f[all_authors_facet][]=Kohler%2C+Sandra%2C+1940-"" target=""_blank"">PSU Catalog Link</a>","<a href=""https://pabook.libraries.psu.edu/literary-cultural-heritage-map-pa/bios/Kohler__Sandra"" target=""_blank"">Expanded Biography</a>",https://pabook.libraries.psu.edu/sites/default/files/biosimages/Kohler__Sandra.jpg,40.799835,-76.862819,Photo Credit: Sandra Kohler. Photograph. Licensed under Fair Use. Cropped to 4x3. Source: Online Resource. Source: https://www.upress.pitt.edu/wp-content/uploads/2019/01/KohlerSandra-432x535.jpg.,,"Selinsgrove, PA | Snyder County | <a href=""https://pabook.libraries.psu.edu/literary-cultural-heritage-map-pa/bios/Kohler__Sandra"" target=""_blank"">Expanded Biography</a>","<a href=""https://catalog.libraries.psu.edu/?f[all_authors_facet][]=Kohler%2C+Sandra%2C+1940-"" target=""_blank"">PSU Catalog Link</a>"
E. L. Konigsburg,Young Adult (YA),Young Adult (YA) | Children's,02/10/1950,4/19/2013,2/10/1930 - 4/19/2013,"<p>Born on February 10, 1930, in New York City, Elaine Lobl (E.L.) Konigsburg grew up in various towns in Pennsylvania. She graduated from the Carnegie Institute of Technology and the University of Pittsburgh with a major in chemistry, and she would later become a science teacher schoolteacher and a writer of juvenile fiction. Konigsburg has won the Newbery Medal twice, for <em>From the Mixed-Up Files of Mrs. Basil E. Frankweiler</em> and <em>The View From Saturday</em>. Read more <a href=""http://<https://www.britannica.com/biography/E-L-Konigsburg>"" target=""_blank"">here</a></p><p>Hollar, Sherman. ""E.L. Konigsburg."" <em>Britannica.</em> 6 February 2020. 11 September 2020.</p>","Farrell, PA",Mercer County,,"<a href=""https://catalog.libraries.psu.edu/?f[all_authors_facet][]=Konigsburg%2C+E.+L."" target=""_blank"">PSU Catalog Link</a>","<a href=""https://pabook.libraries.psu.edu/literary-cultural-heritage-map-pa/bios/Konigsburg__Elaine"" target=""_blank"">Expanded Biography</a>",https://pabook.libraries.psu.edu/sites/default/files/biosimages/Konigsburg__Elaine_Lobl_0.jpg,41.211971,-80.499183,"Photo Credit: Photograph of E.L. Konigsburg. Photograph. Licensed under Fair Use. Cropped to 4x3, Filled background. Source: Online Resource. Source: https://images-na.ssl-images-amazon.com/images/I/21gj1GVsYuL._US230_.jpg.",,"Farrell, PA | Mercer County | <a href=""https://pabook.libraries.psu.edu/literary-cultural-heritage-map-pa/bios/Konigsburg__Elaine"" target=""_blank"">Expanded Biography</a>","<a href=""https://catalog.libraries.psu.edu/?f[all_authors_facet][]=Konigsburg%2C+E.+L."" target=""_blank"">PSU Catalog Link</a>"
Dean Koontz,Fiction,Fiction,07/09/1965,1/1/2050,Born: 7/9/1945,"<p>Born in Everett, Pennsylvania, on July 9, 1945, contemporary writer Dean Koontz grew up in Bedford County, graduated from Shippensburg University, and taught high school English in Mechanicsburg. Read more <a href=""https://www.deankoontz.com/about-dean"" target=""_blank"">here</a>.</p><p>Koontz, Dean. About Dean. <em>Dean Koontz website.</em> 2018. 6 November 2018.</p>","Everett, PA",Bedford County,https://www.deankoontz.com/,"<a href=""https://catalog.libraries.psu.edu/?f[all_authors_facet][]=Koontz%2C+Dean+R.+(Dean+Ray)%2C+1945-"" target=""_blank"">PSU Catalog Link</a>","<a href=""https://pabook.libraries.psu.edu/literary-cultural-heritage-map-pa/bios/Koontz__Dean_Ray"" target=""_blank"">Expanded Biography</a>",https://pabook.libraries.psu.edu/sites/default/files/biosimages/Koontz__Dean.jpg,40.011471,-78.373348,Photo Credit: ALA. Dean Koontz. 30 Jun 2008. Photograph. Licensed under CC BY-NC-SA 2.0. Cropped to 4x3. Source: Flickr. Anaheim.Source: https://bit.ly/3Avj1VT.,,"Everett, PA | Bedford County | <a href=""https://pabook.libraries.psu.edu/literary-cultural-heritage-map-pa/bios/Koontz__Dean_Ray"" target=""_blank"">Expanded Biography</a>","<a href=""https://catalog.libraries.psu.edu/?f[all_authors_facet][]=Koontz%2C+Dean+R.+(Dean+Ray)%2C+1945-"" target=""_blank"">PSU Catalog Link</a> | <a href=""https://www.deankoontz.com/"" target=""_blank"">Personal Website</a>"
